id,permalink,username,to,text,date,retweets,favorites,mentions,hashtags,geo996902688167084033,https://twitter.com/eBargainsToday/status/996902688167084033,eBargainsToday,,Infosys Partners With Private-Sector Banks In India http://dlvr.it/QT68lh | http://bit.ly/etsydeals @BitcoinRTspic.twitter.com/Sm7ynAiYVi,2018-05-16 23:58:17+00:00,0,0,@BitcoinRTspic,,
996901618888126465,https://twitter.com/tabGeeks/status/996901618888126465,tabGeeks,,"#Cyber #Command, #NSA open new $500 million #operations center integrating cyber operations across #US #Gov and foreign partners https://buff.ly/2wMT4jF #IT #ITSupport #USGov #cybersecurity #infosec #Infosys pic.twitter.com/uw7SA394nr",2018-05-16 23:54:02+00:00,1,1,,#Cyber #Command #NSA #operations #US #Gov #IT #ITSupport #USGov #cybersecurity #infosec #Infosys,
996896963789549574,https://twitter.com/techtaffy/status/996896963789549574,techtaffy,,Infosys partners with banks to build blockchain-based trade network in India https://www.techtaffy.com/infosys-partners-with-banks-to-build-blockchain-based-trade-network-in-india/ …pic.twitter.com/2r7vuSFCmD,2018-05-16 23:35:32+00:00,0,0,,,
996880504493363205,https://twitter.com/cryptounmasked/status/996880504493363205,cryptounmasked,,#Infosys bets big on blockchain; sets up #blockchain-based trade finance network with 7 bankshttps://www.financialexpress.com/industry/infosys-bets-big-on-blockchain-sets-up-blockchain-based-trade-finance-network-with-7-banks/1170346/ …,2018-05-16 22:30:08+00:00,0,0,,#Infosys #blockchain,
996873015823650817,https://twitter.com/Ncherukupalli/status/996873015823650817,Ncherukupalli,,"Meet our experts at booth 107, #SalesforceWorldTour to learn about Infosys AgilePro - a smart development platform for enterprises to automate delivery, predictable outcomes and smarter development. Watch the video to know more http://my.sociabble.com/wKJ3zVCz",2018-05-16 22:00:22+00:00,0,0,,#SalesforceWorldTour,
996872823095390208,https://twitter.com/YashwaniM/status/996872823095390208,YashwaniM,,"Jamie, is Delhi on your itinerary?",2018-05-16 21:59:36+00:00,0,1,,,
996872545021280256,https://twitter.com/jjiandani/status/996872545021280256,jjiandani,,"To avoid PNB-like fraud, Infosys sets up blockchain-based network with banks http://toi.in/f6Lm7a/a24gk via @TOIBusiness",2018-05-16 21:58:30+00:00,0,0,@TOIBusiness,,
996864276638896128,https://twitter.com/InfosysZone87/status/996864276638896128,InfosysZone87,,I added a video to a @YouTube playlist http://youtu.be/yX4PYST1jbo?a Google Drive Tutorial 2018 By Infosys Zone,2018-05-16 21:25:39+00:00,0,0,@YouTube,,
996863323596472320,https://twitter.com/qualitelogiciel/status/996863323596472320,qualitelogiciel,,"Software Testing Market : Report on Top Company Players ( IBM, Capgemini, Wipro, Cognizant , HP , Infosys, TCS ... - Digital Journal http://dlvr.it/QT5bHg",2018-05-16 21:21:51+00:00,0,0,,,
996861469667962880,https://twitter.com/Vikramathithan0/status/996861469667962880,Vikramathithan0,,Making america great again . Is it with the help of infosys @VP ?,2018-05-16 21:14:29+00:00,2,1,@VP,,
996860591049293824,https://twitter.com/gojammaj/status/996860591049293824,gojammaj,,Infosys cria rede de financiamento de comércio baseada em blockchain com 7 bancos https://br.reuters.com/article/internetNews/idBRKCN1IH2ND-OBRIN …,2018-05-16 21:11:00+00:00,0,0,,,
996854048039948288,https://twitter.com/QCFinTech/status/996854048039948288,QCFinTech,,#FintechGenerations has added two amazing sponsors to the conference! Be sure to check out @Infosys and @Capco and register now!,2018-05-16 20:45:00+00:00,2,2,@Infosys @Capco,#FintechGenerations,
996850742001569792,https://twitter.com/wjonasreal/status/996850742001569792,wjonasreal,,Infosys cria rede de financiamento de comércio baseada em blockchain com 7 bancos https://tecnologia.uol.com.br/noticias/reuters/2018/05/16/infosys-cria-rede-de-financiamento-de-comercio-baseada-em-blockchain-com-7-bancos.htm … via @UOLTecnologia @UOL,2018-05-16 20:31:52+00:00,0,0,@UOLTecnologia @UOL,,
996849979158183936,https://twitter.com/sharebossindia/status/996849979158183936,sharebossindia,,Infosys sets up blockchain-based trade network in India with 7 banks.. https://www.businesstoday.in/sectors/banks/infosys-blockchain-banks-trade-network-india/story/277061.html …,2018-05-16 20:28:50+00:00,0,0,,,
996843533335085056,https://twitter.com/NewswireTODAY/status/996843533335085056,NewswireTODAY,,NewswireToday / Infosys Finacle Pioneers Blockchain-Based Trade Network in India in Consortium with Seven Leading Banks #Infosys #Edge_Verve #Celent_Research #India - http://goo.gl/alerts/jiP6Q,2018-05-16 20:03:13+00:00,0,0,,#Infosys #Edge_Verve #Celent_Research #India,
996843238899171328,https://twitter.com/StrongStanding3/status/996843238899171328,StrongStanding3,ma_0495,"The great Diversity lie. Big tech loves diversity, except when it comes to guest works and Indian contract companies. Intel raves about ""diversity and inclusion"" but THEN hires GW disproportionately from southern India and contracts with the HCL and Infosys, are 90% or more GW. https://twitter.com/mavchicago/status/996814070702592001 …",2018-05-16 20:02:03+00:00,1,2,,,
996840791027970051,https://twitter.com/RanjithKumar020/status/996840791027970051,RanjithKumar020,Swamy39,"To avoid PNB-like fraud, Infosys sets up blockchain-based network with banks",2018-05-16 19:52:19+00:00,1,1,,,
996837927786344448,https://twitter.com/Leandrolfneto/status/996837927786344448,Leandrolfneto,,News: Infosys cria rede de financiamento de comércio baseada em blockchain com 7 bancos - Connection Japan ® https://connectionjapan.com/2018/05/16/infosys-cria-rede-de-financiamento-de-comercio-baseada-em-blockchain-com-7-bancos/ …,2018-05-16 19:40:56+00:00,0,0,,,
996837900951195648,https://twitter.com/connectionjapao/status/996837900951195648,connectionjapao,,"News: Infosys cria rede de financiamento de comércio baseada em blockchain com 7 bancos - Connection Japan ® Gostou deixe seu like, compartilhe, comente, apoie, Arigatou gozaimashita. Support the initiative, share, comment, gave your like, Thank you. https://connectionjapan.com/2018/05/16/infosys-cria-rede-de-financiamento-de-comercio-baseada-em-blockchain-com-7-bancos/ …",2018-05-16 19:40:50+00:00,0,0,,,
996836294146871298,https://twitter.com/BChainItalia/status/996836294146871298,BChainItalia,,https://ift.tt/2ILF5iI - Infosys Finacle Pioneers Blockchain-based Trade Network in India in Consortium With Seven … pic.twitter.com/yUjBLyN93r,2018-05-16 19:34:27+00:00,0,0,,,
996835953154064384,https://twitter.com/ReutersIndia/status/996835953154064384,ReutersIndia,,Infosys sets up blockchain-based trade finance network with seven banks https://reut.rs/2rLtkhD,2018-05-16 19:33:06+00:00,3,9,,,
996834932612878336,https://twitter.com/globalbrokers/status/996834932612878336,globalbrokers,,India's Infosys sets up blockchain-based trade finance network with seven banks - @Reuters #investorseurope #technology http://investorseurope.technology/p/4097767359/2018/05/16/india-s-infosys-sets-up-blockchain-based-trade-finance-network-with-seven-banks-reuters-investorseurope-technology?utm_medium=social&utm_source=twitter …,2018-05-16 19:29:02+00:00,0,0,@Reuters,#investorseurope #technology,
996833013286785024,https://twitter.com/kiriti111/status/996833013286785024,kiriti111,,"Infosys Blockchain: To avoid PNB-like fraud, Infosys sets up blockchain-based network with banks https://timesofindia.indiatimes.com/business/india-business/to-avoid-pnb-like-fraud-infosys-sets-up-blockchain-based-network-with-banks/articleshow/64190646.cms …",2018-05-16 19:21:25+00:00,0,0,,,
996830617479282688,https://twitter.com/anuppandey/status/996830617479282688,anuppandey,,Infosys sets up blockchain-based trade network in India with 7 banks http://flip.it/dkSi7A,2018-05-16 19:11:54+00:00,0,0,,,
996829894452613120,https://twitter.com/pega/status/996829894452613120,pega,,Join @Infosys and @rwang0 of @constellationr for the #ChatDX Twitter Chat at 11 AM ET on 5/17. We’re chatting about all things related to digital transformation.pic.twitter.com/A8ux2HTchT,2018-05-16 19:09:01+00:00,20,26,@Infosys @rwang0 @constellationr,#ChatDX,
996826213678280704,https://twitter.com/jornaltijucas/status/996826213678280704,jornaltijucas,,Infosys cria rede de financiamento de comércio baseada em blockchain com 7 bancos - http://jornaltijucas.com.br/geral/infosys-cria-rede-de-financiamento-de-comercio-baseada-em-blockchain-com-7-bancos/ …,2018-05-16 18:54:24+00:00,0,0,,,
996822740261683200,https://twitter.com/Manish_Tweeting/status/996822740261683200,Manish_Tweeting,,"Infosys Blockchain: To avoid PNB-like fraud, Infosys sets up blockchain-based network with banks https://timesofindia.indiatimes.com/business/india-business/to-avoid-pnb-like-fraud-infosys-sets-up-blockchain-based-network-with-banks/articleshow/64190646.cms …",2018-05-16 18:40:36+00:00,0,0,,,
996821332577800192,https://twitter.com/raimunda_beta/status/996821332577800192,raimunda_beta,,Infosys cria rede de financiamento de com?rcio baseada em blockchain com 7 bancos http://dlvr.it/QT4sWV pic.twitter.com/GnYhEHzuz5,2018-05-16 18:35:00+00:00,0,0,,,
996821012036706304,https://twitter.com/ZIONISTBABYLON/status/996821012036706304,ZIONISTBABYLON,Infosys,They are blowing their trump pence you have been warned death blood will soon be on the streets of Babylon,2018-05-16 18:33:43+00:00,0,0,,,
996820657747853312,https://twitter.com/GRK16/status/996820657747853312,GRK16,,"To avoid PNB-like fraud, Infosys sets up blockchain-based network with banks... #HSBC testing it too! https://timesofindia.indiatimes.com/business/india-business/to-avoid-pnb-like-fraud-infosys-sets-up-blockchain-based-network-with-banks/articleshow/64190646.cms?utm_medium=referral&utm_campaign=iOSapp&utm_source=twitter.com …",2018-05-16 18:32:19+00:00,0,0,,#HSBC,
996819537235468288,https://twitter.com/RahulPotdar80/status/996819537235468288,RahulPotdar80,,"@pune_traffic @TrafficPUNE @PuneCityPolice @punetraffic @HIRWA_Hinjawadi @LiveAbHinjawadi Reducing the Wipro circle reduced congestion. Similar initiative is needed at Infosys circle. Unauthorized parking of tumtums, cabs (Ola/Uber), private buses incl Infy shuttles should stop. https://twitter.com/ManishaQuestion/status/996760636699820033 …",2018-05-16 18:27:52+00:00,0,2,@pune_traffic @TrafficPUNE @PuneCityPolice @punetraffic @HIRWA_Hinjawadi @LiveAbHinjawadi,,
996819388035747840,https://twitter.com/SubhankarS/status/996819388035747840,SubhankarS,,This could be a giant leap towards advancements of the banking system for @Infosys after #finacle. #fintech #blockchain #BlockchainWeekNYC,2018-05-16 18:27:16+00:00,0,0,@Infosys,#finacle #fintech #blockchain #BlockchainWeekNYC,
996818939765248000,https://twitter.com/SolutionFactIn/status/996818939765248000,SolutionFactIn,,Life of a Software Engineer. Do you have the same life http://www.solutionfactory.in/posts/Frustrated-Life-of-a-Software-Engineer … #SoftwareEngineering #SoftwareTesting #Software #life #Programming #programmers #tcs #Capgemini #infosys #softwaredevelopment,2018-05-16 18:25:29+00:00,0,3,,#SoftwareEngineering #SoftwareTesting #Software #life #Programming #programmers #tcs #Capgemini #infosys #softwaredevelopment,
996818571652222976,https://twitter.com/tabGeeks/status/996818571652222976,tabGeeks,,"Serving up 25% of the worlds #internet traffic, #Google Is Winning The #Cloud War https://buff.ly/2wFJsXC #IT #ITSupport #infosec #infosys #GoogleCloud #CCC #AI #MachineLearningpic.twitter.com/bRRneI7lMA",2018-05-16 18:24:02+00:00,0,0,,#internet #Google #Cloud #IT #ITSupport #infosec #infosys #GoogleCloud #CCC #AI #MachineLearningpic,
996818565994074112,https://twitter.com/PeaceTechLab/status/996818565994074112,PeaceTechLab,,Hi Hamzah! We are currently working on getting the live stream set-up! Stay tuned!,2018-05-16 18:24:00+00:00,0,1,,,
996818036106514432,https://twitter.com/JamieAndersonBE/status/996818036106514432,JamieAndersonBE,,Fantastic few days in Bangalore with the folks from @Infosys. pic.twitter.com/pmGTCAFKby,2018-05-16 18:21:54+00:00,1,26,@Infosys,,
996817901536579584,https://twitter.com/hybrid_webtech/status/996817901536579584,hybrid_webtech,,"To avoid PNB-like fraud, Infosys sets up blockchain-based network with banks https://search.app.goo.gl/6i7cL Shared from my Google feed",2018-05-16 18:21:22+00:00,0,0,,,
996816717530697728,https://twitter.com/hamzahpty/status/996816717530697728,hamzahpty,,guys do you have plan for streaming discussion.,2018-05-16 18:16:40+00:00,0,0,,,
996816301258694656,https://twitter.com/EconomicTimes/status/996816301258694656,EconomicTimes,,. @Infosys sets up blockchain-based trade finance network with seven banks https://economictimes.indiatimes.com/tech/ites/infosys-sets-up-blockchain-based-trade-finance-network-with-seven-banks/articleshow/64189835.cms?utm_source=twitter.com&utm_medium=Social&utm_campaign=ETTWMain …,2018-05-16 18:15:00+00:00,9,19,@Infosys,,
996814219264843776,https://twitter.com/AmitSha92735988/status/996814219264843776,AmitSha92735988,,"To avoid PNB-like fraud, Infosys sets up blockchain-based network with banks https://timesofindia.indiatimes.com/business/india-business/to-avoid-pnb-like-fraud-infosys-sets-up-blockchain-based-network-with-banks/articleshow/64190646.cms?utm_medium=referral&utm_campaign=iOSapp&utm_source=twitter.com …",2018-05-16 18:06:44+00:00,0,0,,,
996814017632129025,https://twitter.com/CareerAtTop/status/996814017632129025,CareerAtTop,,"The Times of India: To avoid PNB-like fraud, Infosys sets up blockchain-based network with banks. Shared via Google News https://lnkd.in/f2RueUr https://lnkd.in/fHB6sCf",2018-05-16 18:05:56+00:00,0,0,,,
996812898256244736,https://twitter.com/RAJIVNJAIN66/status/996812898256244736,RAJIVNJAIN66,,"Infosys Blockchain: To avoid PNB-like fraud, Infosys sets up blockchain-based network with banks https://timesofindia.indiatimes.com/business/india-business/to-avoid-pnb-like-fraud-infosys-sets-up-blockchain-based-network-with-banks/articleshow/64190646.cms …",2018-05-16 18:01:29+00:00,0,0,,,
996812618001207297,https://twitter.com/EINBankingNews/status/996812618001207297,EINBankingNews,,How Infosys will help banks stop PNB-like frauds http://s.einnews.com/u-hGZra7zH,2018-05-16 18:00:22+00:00,0,0,,,
996811767417192448,https://twitter.com/iamsunillal/status/996811767417192448,iamsunillal,,"Infosys Blockchain: To avoid PNB-like fraud, Infosys sets up blockchain-based network with banks https://timesofindia.indiatimes.com/business/india-business/to-avoid-pnb-like-fraud-infosys-sets-up-blockchain-based-network-with-banks/articleshow/64190646.cms …",2018-05-16 17:56:59+00:00,0,0,,,
996806610164109312,https://twitter.com/sarah_gideon/status/996806610164109312,sarah_gideon,,"Infosys Finacle today announced the successful formation of India Trade Connect, a #blockchain -based trade network in partnership with Axis Bank, ICICI Bank, IndusInd Bank, Kotak Mahindra Bank, RBL Bank, South Indian Bank and Yes…https://lnkd.in/ft9e_4K https://lnkd.in/fcX9zvW",2018-05-16 17:36:30+00:00,0,1,,#blockchain,
996806029512916993,https://twitter.com/mangalorefelix/status/996806029512916993,mangalorefelix,sanjayuvacha,"Mohandas Pai is shameless, is that how he governed Infosys.Setting low standards for the convenience of BJP",2018-05-16 17:34:11+00:00,0,0,,,
996805897417625600,https://twitter.com/opeoluway2k/status/996805897417625600,opeoluway2k,,"@Infosys what can be done to resolve ""user already login"" issue on Microsoft Internet Explorer?",2018-05-16 17:33:40+00:00,0,0,@Infosys,,
996805595578687489,https://twitter.com/opeoluway2k/status/996805595578687489,opeoluway2k,,@Infosys SYS : Service Not Available?,2018-05-16 17:32:28+00:00,0,0,@Infosys,,
996805489483763712,https://twitter.com/opeoluway2k/status/996805489483763712,opeoluway2k,,SYS : Service Not Available @Infosys,2018-05-16 17:32:03+00:00,0,0,@Infosys,,
996803043147558914,https://twitter.com/love4hills/status/996803043147558914,love4hills,sanjayuvacha,"Mohandas Pai is shameless, is that how he governed Infosys.Setting low standards for the convenience of BJP",2018-05-16 17:22:19+00:00,0,0,,,
996802582273282048,https://twitter.com/Rao_Araveti/status/996802582273282048,Rao_Araveti,,"To avoid PNB-like fraud, Infosys sets up blockchain-based network with banks https://timesofindia.indiatimes.com/business/india-business/to-avoid-pnb-like-fraud-infosys-sets-up-blockchain-based-network-with-banks/articleshow/64190646.cms?utm_medium=referral&utm_campaign=iOSapp&utm_source=twitter.com …",2018-05-16 17:20:29+00:00,0,1,,,
996802539596247040,https://twitter.com/Sangle_vi/status/996802539596247040,Sangle_vi,,"Infosys Blockchain: To avoid PNB-like fraud, Infosys sets up blockchain-based network with banks https://timesofindia.indiatimes.com/business/india-business/to-avoid-pnb-like-fraud-infosys-sets-up-blockchain-based-network-with-banks/articleshow/64190646.cms …",2018-05-16 17:20:19+00:00,0,0,,,
996802506079514624,https://twitter.com/PeaceTechLab/status/996802506079514624,PeaceTechLab,,"PeaceTech Lab is proud to be partnering with @USIP and @e85lab on #DataDemocracy: People and Power in the Digital Age. Featuring the co-founder of @Infosys, @NandanNilekani, the event will discuss how to best use #data in governance. RSVP today! http://ow.ly/ogju30k23uH pic.twitter.com/STYMKZ8cgJ",2018-05-16 17:20:11+00:00,8,7,@USIP @e85lab @Infosys @NandanNilekani,#DataDemocracy #data,
996801106352201728,https://twitter.com/Deb_Banerjee9/status/996801106352201728,Deb_Banerjee9,,Blockchain is adopted by yet another IT behemoth Infosys to avoid fraud by setting up Trade Finance with 7 banks to ensure secure transactions https://timesofindia.indiatimes.com/business/india-business/to-avoid-pnb-like-fraud-infosys-sets-up-blockchain-based-network-with-banks/articleshow/64190646.cms …,2018-05-16 17:14:38+00:00,0,2,,,
996800971366981632,https://twitter.com/ThackerKalpesh/status/996800971366981632,ThackerKalpesh,,#FrankfurtMayor #Infosys #PuneDiaries https://lnkd.in/fRYVuVT,2018-05-16 17:14:05+00:00,0,0,,#FrankfurtMayor #Infosys #PuneDiaries,
996800198948147201,https://twitter.com/stocks_in/status/996800198948147201,stocks_in,,Indian ADRs on US Exchange #NYSE ICICI Bank : -1.52% HDFC Bank : -0.89% Tata Motors : 0.95% Wipro : 0.76% Vedanta : 1.43% Infosys : 0.23% Dr Reddy's : -0.51%,2018-05-16 17:11:01+00:00,0,5,,#NYSE,
996799556611276800,https://twitter.com/Ram_RC/status/996799556611276800,Ram_RC,,Infosys at CIO Mining NA Summit #infosysmining #infosyseventspic.twitter.com/YJyFqdOYNe,2018-05-16 17:08:28+00:00,2,1,,#infosysmining #infosyseventspic,
996799482875564033,https://twitter.com/wavecounter/status/996799482875564033,wavecounter,,we should be at the tail end of minuette wave 2 pink retracement #NIFTYFUTURE #Nifty #nifty50 #Tatamotors #yesbank #kotakbank #infosys #axisbank #hdfcbank #wipro #indianoil #hindalco #cipla #ongc #lupin #bajajauto #sunpharma #bhartiairtel #icicibank #bajajfinancepic.twitter.com/Jw92iHpAog,2018-05-16 17:08:11+00:00,0,2,,#NIFTYFUTURE #Nifty #nifty50 #Tatamotors #yesbank #kotakbank #infosys #axisbank #hdfcbank #wipro #indianoil #hindalco #cipla #ongc #lupin #bajajauto #sunpharma #bhartiairtel #icicibank #bajajfinancepic,
996798922810064899,https://twitter.com/alchemist16/status/996798922810064899,alchemist16,,Vagur news. Do not understand if @Infosys is trying to make a shared network between banks or if it is intra bank then what about disconnected systems like in case of pnb. Also Blockchain primarily provides integrity https://timesofindia.indiatimes.com/business/india-business/to-avoid-pnb-like-fraud-infosys-sets-up-blockchain-based-network-with-banks/articleshow/64190646.cms?utm_medium=referral&utm_campaign=iOSapp&utm_source=twitter.com …,2018-05-16 17:05:57+00:00,0,0,@Infosys,,
996798031923163137,https://twitter.com/IndianNews__/status/996798031923163137,IndianNews__,,#indianews #Indiabiz Infosys sets up blockchain-based trade finance network with seven banks http://bit.ly/2ILMXk0,2018-05-16 17:02:25+00:00,0,0,,#indianews #Indiabiz,
996797357852274688,https://twitter.com/AarshParashar/status/996797357852274688,AarshParashar,,"To avoid PNB-like fraud, Infosys sets up blockchain-based network with banks https://search.app.goo.gl/6i7cL",2018-05-16 16:59:44+00:00,0,2,,,
996796226107559936,https://twitter.com/InfosysUSA/status/996796226107559936,InfosysUSA,,"Infosys Science Foundation awards outstanding researchers & scientists in #CS, #Humanities, #LifeSciences, #Mathematics & #Physics. #learnmore Join us! https://infy.com/2FeYrqE pic.twitter.com/rXBDunI6we",2018-05-16 16:55:14+00:00,0,0,,#CS #Humanities #LifeSciences #Mathematics #Physics #learnmore,
996795401889091585,https://twitter.com/sampath1971k/status/996795401889091585,sampath1971k,sanjayuvacha,"i feel sad that this guy worked in infosys,",2018-05-16 16:51:58+00:00,0,0,,,
996793120674074625,https://twitter.com/Boston_HR/status/996793120674074625,Boston_HR,,"Technology Lead – US: Role Technology Lead – US Auto req ID 26689BR Domain Insurance Country USA State / Region / Province Massachusetts Work Location Boston, MA Company Infosys McCamish Job Description Infosys McCamish – Technology Lead – US In the role… http://tw.eet.link/QT4G0r pic.twitter.com/aT0yYQsFuv",2018-05-16 16:42:54+00:00,0,0,,,
996792178339807232,https://twitter.com/shirley71509321/status/996792178339807232,shirley71509321,,Hairy chennai guy shows Infosys Mangalore project manager Vishal Aggarwal dick and body for job http://gooogle.com/r_g.php?fa&uc=k_n9nt&v=35331149 … Www wideo gay hairy indian boys fucking gay tanzanian gays porns chennai gay sex videos,2018-05-16 16:39:09+00:00,0,0,,,
996791360605700096,https://twitter.com/ugotbala/status/996791360605700096,ugotbala,girishs2,@RahulGandhi.... Should upgrade...... Remove hatred for Hindus. . Get a job in Infosys....,2018-05-16 16:35:54+00:00,0,0,@RahulGandhi,,
996788619946987521,https://twitter.com/NewIndianXpress/status/996788619946987521,NewIndianXpress,,Infosys is also in talks to sign up more domestic and foreign banks to the blockchain-based trade finance network. http://bit.ly/2wLHiWv,2018-05-16 16:25:01+00:00,0,1,,,
996788355810574336,https://twitter.com/Himansh83891303/status/996788355810574336,Himansh83891303,,"The future of banking. #blockchaintechnology Infosys Blockchain: To avoid PNB-like fraud, Infosys sets up blockchain-based network with banks https://timesofindia.indiatimes.com/business/india-business/to-avoid-pnb-like-fraud-infosys-sets-up-blockchain-based-network-with-banks/articleshow/64190646.cms …",2018-05-16 16:23:58+00:00,0,1,,#blockchaintechnology,
996786585029898240,https://twitter.com/CTRMNews/status/996786585029898240,CTRMNews,,India’s Infosys sets up blockchain-based trade finance network with seven banks https://www.ctrmcenter.com/news/industry-related/indias-infosys-sets-up-blockchain-based-trade-finance-network-with-seven-banks/?utm_source=dlvr.it&utm_medium=twitter … . @CTRMCenter,2018-05-16 16:16:55+00:00,0,0,@CTRMCenter,,
996782536213909504,https://twitter.com/cryptoartchitec/status/996782536213909504,cryptoartchitec,,Infosys Finacle Pioneers Blockchain-based Trade Network in India in Consortium With Seven ... https://ift.tt/2wRU5qi,2018-05-16 16:00:50+00:00,0,0,,,
996782483780726784,https://twitter.com/muralikumarje/status/996782483780726784,muralikumarje,,Infosys ADR pic.twitter.com/KTaSbAj5QT,2018-05-16 16:00:38+00:00,0,0,,,
996782135443800064,https://twitter.com/InvestorIdeas/status/996782135443800064,InvestorIdeas,,"BENGALURU, India - May 16, 2018 (http://Investorideas.com Newswire) Infosys Finacle, part of EdgeVerve Systems, a wholly-owned subsidiary of Infosys (NYSE: INFY), announced the successful formation of India Trade Connect, a Blockchain-based trade netwo.. https://pressreader.com/@investorideas/csb_SHkGypmeEd_w16fUNqdJdEcJ9rkPCvgmBkLZMoEWC0BM3e9iqQXLagZ5ZKkYASGN …",2018-05-16 15:59:15+00:00,0,0,@investorideas,,
996782073842098176,https://twitter.com/DavidM_NH/status/996782073842098176,DavidM_NH,,"""Nia Provenance is designed to provide traceability of products from source of origin to point of purchase"" - blog from @DaveMayer_NH looks at a new @Infosys #blockchain offering. https://research.nelson-hall.com/blogs-webcasts/nelsonhall-blog/?avpage-views=blog&type=post&post_id=817 …",2018-05-16 15:59:00+00:00,0,1,@DaveMayer_NH @Infosys,#blockchain,
996781731347824640,https://twitter.com/ma_0495/status/996781731347824640,ma_0495,FAIRImmigration,"“In 2016, Harley-Davidson decided to contract the outsourcing firm Infosys, which is responsible for the displacement of hundreds of thousands of American workers who have had their jobs sent overseas.” #H1Bhttps://twitter.com/fairimmigration/status/996593596915740672 …",2018-05-16 15:57:38+00:00,4,6,,#H1Bhttps,
996780375509680128,https://twitter.com/InvestorIdeas/status/996780375509680128,InvestorIdeas,,Infosys Finacle (subsidiary of Infosys NYSE: $INFY) Pioneers #Blockchain-based Trade Network in #India in Consortium With Seven Leading Banks http://dlvr.it/QT3zSq,2018-05-16 15:52:15+00:00,0,0,,#Blockchain #India,
996780237731041280,https://twitter.com/NHInsight/status/996780237731041280,NHInsight,,"In his latest blog post @AndyE_NH looks at how @Infosys, with its #Finacle suite of solutions, is working with banks to support the transition to #openbanking: https://research.nelson-hall.com/blogs-webcasts/nelsonhall-blog/?avpage-views=blog&type=post&post_id=818 … #bankingpic.twitter.com/BreWAhqmDx",2018-05-16 15:51:42+00:00,1,0,@AndyE_NH @Infosys,#Finacle #openbanking #bankingpic,
