id,permalink,username,to,text,date,retweets,favorites,mentions,hashtags,geo
997623381687025664,https://twitter.com/Hire_Denver/status/997623381687025664,Hire_Denver,,"Technology Lead – US: Role Technology Lead – US Auto req ID 30303BR Domain Java Skillset Frameworks and Specifications , Spring Country USA State / Region / Province Colorado Work Location Denver, CO Company ITL USA Job Description Infosys– FSADM3-… http://tw.eet.link/QTLZ3h pic.twitter.com/iqSqLuVi1a",2018-05-18 23:42:03+00:00,0,0,,,
997619404409106432,https://twitter.com/ReallyGupta/status/997619404409106432,ReallyGupta,,Fake quote of Infosys co-founder Narayana Murthy praising PM Modi viral on social media https://www.altnews.in/fake-quote-of-infosys-co-founder-narayana-murthy-praising-pm-modi-viral-on-social-media/ … via @AltNews,2018-05-18 23:26:15+00:00,1,1,@AltNews,,
997618839553798146,https://twitter.com/tabGeeks/status/997618839553798146,tabGeeks,,From The #Olympics To A #Unicorn: How ' #Cyber Immune System' #Darktrace Hit A $1.3BN #Valuation https://buff.ly/2wMfa5w #IT #ITSupport #ITHero #Security #cybersecurity #Infosec #infosys pic.twitter.com/9MnErau9qV,2018-05-18 23:24:00+00:00,1,1,,#Olympics #Unicorn #Cyber #Darktrace #Valuation #IT #ITSupport #ITHero #Security #cybersecurity #Infosec #infosys,
997616583735414789,https://twitter.com/TechVisorNL/status/997616583735414789,TechVisorNL,,Infosys Consulting: Securing internal applications the smart way - http://tinyurl.com/y999bmv8 #security #cybersecurity #customerexperience #CX,2018-05-18 23:15:03+00:00,0,2,,#security #cybersecurity #customerexperience #CX,
997615674913533954,https://twitter.com/SaffronWatch/status/997615674913533954,SaffronWatch,,Fake quote of Infosys co-founder Narayana Murthy praising PM Modi viral on social media https://www.altnews.in/fake-quote-of-infosys-co-founder-narayana-murthy-praising-pm-modi-viral-on-social-media/ …,2018-05-18 23:11:26+00:00,8,9,,,
997614026627731456,https://twitter.com/RezaDBoss1/status/997614026627731456,RezaDBoss1,,"আজকের সেহেরী #অফিসে — feeling blessed at Genex Infosys Limited, Mascot Plaza, Uttara https://www.facebook.com/RATULDBOSS/posts/1805736352820472 …",2018-05-18 23:04:53+00:00,0,0,,#অফ,
997610142475550721,https://twitter.com/stevenmfowler/status/997610142475550721,stevenmfowler,,Infosys ropes in seven private banks to deploy new #blockchain solution for trade financehttps://yourstory.com/2018/05/infosys-ropes-seven-private-banks-deploy-new-blockchain-solution-trade-finance/ …,2018-05-18 22:49:27+00:00,0,0,,#blockchain,
997608297854328832,https://twitter.com/CoinTradingRoom/status/997608297854328832,CoinTradingRoom,,Infosys Partners with 7 Banks for Blockchain Trade Finance Network https://www.coindesk.com/infosys-partners-with-7-banks-for-blockchain-trade-finance-network/ … #cryptocurrency #bitcoin #blockchain #btc #ltc #trading #usd #litecoin #crypto #eth #ethereum #market #monero #xmr #fintech #ICO #altcoin #tokensale #cryptocurrencies #ada #iota #das,2018-05-18 22:42:07+00:00,0,0,,#cryptocurrency #bitcoin #blockchain #btc #ltc #trading #usd #litecoin #crypto #eth #ethereum #market #monero #xmr #fintech #ICO #altcoin #tokensale #cryptocurrencies #ada #iota #das,
997608160159518720,https://twitter.com/blockaired/status/997608160159518720,blockaired,,IT giant Infosys has built a blockchain-based trade finance platform involving seven Indian banks including ICICI and Axis. #cryptocurrency #cryptocurrencies #crypto #ico #blockchainpic.twitter.com/71ZWcvYnsu,2018-05-18 22:41:34+00:00,1,0,,#cryptocurrency #cryptocurrencies #crypto #ico #blockchainpic,
997607272200077312,https://twitter.com/ICA_CSaB/status/997607272200077312,ICA_CSaB,,"1/2 #ica18 is just around the corner & we have a schedule full of great panels, our first-ever problem solving session, business meeting, & joint reception with @ica_cm, @ICAGames, & @ica_infosys pic.twitter.com/4RPQ478HVz",2018-05-18 22:38:02+00:00,1,10,@ica_cm @ICAGames @ica_infosys,#ica18,
997603079909408773,https://twitter.com/Inc42/status/997603079909408773,Inc42,,Big IT giants and banks making way for #blockchain solutions reflect the growing acceptance of blockchain... @Infosys https://inc42.com/buzz/blockchain-infosys-creates-document-tracking-solution/ …,2018-05-18 22:21:23+00:00,0,0,@Infosys,#blockchain,
997599678068936705,https://twitter.com/crypto_tipo/status/997599678068936705,crypto_tipo,,Infosys Teams Up with Seven Banks for Blockchain Trade Finance Network - http://cryptotipo.com/infosys-teams-up-with-seven-banks-for-blockchain-trade-finance-network/ …pic.twitter.com/QA5iAJ5zSF,2018-05-18 22:07:52+00:00,0,0,,,
997592172529512448,https://twitter.com/ForWorldTruth/status/997592172529512448,ForWorldTruth,,Salil Parekh Becomes The New Infosys CEO https://www.worldconspiraciesnews.com/salil-parekh-becomes-the-new-infosys-ceo/ …pic.twitter.com/U7qh53tvHM,2018-05-18 21:38:02+00:00,0,0,,,
997590159431471104,https://twitter.com/TechVisorNL/status/997590159431471104,TechVisorNL,,Infosys Consulting: How to get customers to love your brand - http://tinyurl.com/y9ubmr2u,2018-05-18 21:30:02+00:00,0,0,,,
997573976611172352,https://twitter.com/DLTsource/status/997573976611172352,DLTsource,,Infosys Partners with 7 Banks for Blockchain Trade Finance Network http://btc.ms/BlockchainTrade #blockchain #blockchains #blockchaintech #blockchaintechnology #fintech #finance #tech #technology #crypto #cryptos #cryptocurrency #cryptocurrencies #infosys #banks,2018-05-18 20:25:44+00:00,0,0,,#blockchain #blockchains #blockchaintech #blockchaintechnology #fintech #finance #tech #technology #crypto #cryptos #cryptocurrency #cryptocurrencies #infosys #banks,
997573703088201728,https://twitter.com/thedanielchiang/status/997573703088201728,thedanielchiang,,Infosys Creates Blockchain Fintech Solution to Improve Trade Finance in India #blockchain #supplychain #indiahttps://cryptosumer.com/2018/05/18/infosys-creates-blockchain-fintech-solution-to-improve-trade-finance-in-india/ …,2018-05-18 20:24:39+00:00,2,1,,#blockchain #supplychain #indiahttps,
997570811362979840,https://twitter.com/Huymt2816/status/997570811362979840,Huymt2816,,Infosys Partners with 7 Banks for Blockchain Trade Finance Network http://okchances.com/infosys-partners-with-7-banks-for-blockchain-trade-finance-network.htm …,2018-05-18 20:13:10+00:00,0,0,,,
997570116043792384,https://twitter.com/CryptoRadarNews/status/997570116043792384,CryptoRadarNews,,Leading Indian Banks Form Blockchain Trade Network with InfoSys https://is.gd/7VzH8h pic.twitter.com/3R1oJGELlk,2018-05-18 20:10:24+00:00,0,0,,,
997567709973024770,https://twitter.com/BChainItalia/status/997567709973024770,BChainItalia,,https://ift.tt/2ITDYxw - Leading Indian Banks Form Blockchain Trade Network with InfoSys pic.twitter.com/WRPtHr6Z5D,2018-05-18 20:00:50+00:00,0,0,,,
997562466400956417,https://twitter.com/Cryptopia_Press/status/997562466400956417,Cryptopia_Press,,Infosys Partners with 7 Banks for Blockchain Trade Finance Network https://buff.ly/2Itx5Dq #CryptopiaPress #Crypto #Blockchain,2018-05-18 19:40:00+00:00,1,1,,#CryptopiaPress #Crypto #Blockchain,
997557473425883136,https://twitter.com/TimurBETEP/status/997557473425883136,TimurBETEP,,Infosys заключила партнерство с 7 банками для запуска торговой блокчейн-сети https://bitjournal.media/18-05-2018/infosys-zaklyuchila-partnerstvo-s-7-bankami-dlya-zapuska-torgovoj-blokchejn-seti/ …,2018-05-18 19:20:10+00:00,0,0,,,
997552514781368320,https://twitter.com/TheCryptopedic/status/997552514781368320,TheCryptopedic,,Infosys Partners with 7 Banks for Blockchain Trade Finance Network https://www.cryptopedic.com/news/infosys-partners-with-7-banks-for-blockchain-trade-finance-network/ …pic.twitter.com/qyo5o3JurA,2018-05-18 19:00:27+00:00,0,0,,,
997552499618959360,https://twitter.com/AstraNetwork_co/status/997552499618959360,AstraNetwork_co,,Infosys Partners with 7 Banks for #Blockchain Trade #Finance Network via @CoinDesk https://buff.ly/2Itx5Dq #tradingpic.twitter.com/0CgHha6nql,2018-05-18 19:00:24+00:00,1,1,@CoinDesk,#Blockchain #Finance #tradingpic,
997552402185076736,https://twitter.com/kuriharan/status/997552402185076736,kuriharan,,Update. #Infosys Partners with 7 Banks for #Blockchain Trade Finance Network http://bit.ly/2IrGn35 via @CoinDesk #tech #digital #data #business,2018-05-18 19:00:00+00:00,4,1,@CoinDesk,#Infosys #Blockchain #tech #digital #data #business,
997551216984027137,https://twitter.com/thoughtbuoy/status/997551216984027137,thoughtbuoy,,Fake quote of Infosys co-founder Narayana Murthy praising PM Modi viral on social media https://www.altnews.in/fake-quote-of-infosys-co-founder-narayana-murthy-praising-pm-modi-viral-on-social-media/ … via @AltNews,2018-05-18 18:55:18+00:00,25,41,@AltNews,,
997548398558396417,https://twitter.com/madhu_venugopal/status/997548398558396417,madhu_venugopal,rwang0,Great insights! @rwang0 glad to be a part @Infosys https://twitter.com/rwang0/status/997227576455192576 …,2018-05-18 18:44:06+00:00,0,0,@rwang0 @Infosys,,
997547781727424513,https://twitter.com/5IVI4RT/status/997547781727424513,5IVI4RT,,Infosys Partners with 7 Banks for Blockchain Trade Finance Network #infosys #blockchain #tradefinance https://lnkd.in/eS5-pGY https://lnkd.in/e_PFGuE,2018-05-18 18:41:39+00:00,0,0,,#infosys #blockchain #tradefinance,
997547409763860481,https://twitter.com/omnoptix/status/997547409763860481,omnoptix,,Infosys Partners with 7 Banks for Blockchain Trade Finance Network http://ow.ly/Z2Je30k3Sjn,2018-05-18 18:40:10+00:00,0,0,,,
997546403181355009,https://twitter.com/tokens24/status/997546403181355009,tokens24,,India: Infosys Sets Up Blockchain Trade Finance Network With Seven Banks. #india #infosys #blockchainhttps://buff.ly/2IWDl66,2018-05-18 18:36:10+00:00,1,1,,#india #infosys #blockchainhttps,
997542974627213317,https://twitter.com/KkkData/status/997542974627213317,KkkData,,KKK INFORM DATA SERVICES: Mail sent by Narayan Murthy to all Infosys staff:: https://kkkinformdataservices.blogspot.com/2018/05/mail-sent-by-narayan-murthy-to-all.html …,2018-05-18 18:22:33+00:00,0,3,,,
997541142055895040,https://twitter.com/Hire_Atl/status/997541142055895040,Hire_Atl,,"Project Manager – US: Role Project Manager – US Auto req ID 27344BR Domain Insurance Country USA State / Region / Province Georgia Work Location Atlanta, GA Company Infosys McCamish Job Description Infosys McCamish – Project Manager – US As a Project… http://tw.eet.link/QTKKjg",2018-05-18 18:15:16+00:00,0,0,,,
997541137220030464,https://twitter.com/heraldks/status/997541137220030464,heraldks,,"Generation Investment Management Llp Position In Infosys LTD $INFY Was Has Increased; As Wells Fargo Co New $WFC Stock Price Declined, Holder Orbis Investment Management Decreased Its Position by $1.58 Million https://heraldks.com/generation-investment-management-llp-position-in-infosys-ltd-infy-was-has-increased-as-wells-fargo-co-new-wfc-stock-price-declined-holder-orbis-investment-management-decreased-its-position-by-1/ …",2018-05-18 18:15:15+00:00,0,0,,,
997540914997456897,https://twitter.com/whichblockchain/status/997540914997456897,whichblockchain,,Infosys Partners With 7 Banks For Blockchain Trade Finance Network http://whichblockchain.com/news/infosys-partners-with-7-banks-for-blockchain-trade-finance-network/ … #blockchain #IT #Whichblockchain #technology #development,2018-05-18 18:14:22+00:00,2,1,,#blockchain #IT #Whichblockchain #technology #development,
997540236510064645,https://twitter.com/InfosysTV/status/997540236510064645,InfosysTV,,Infosys TV : A female cop to lead police federation for the fir... http://infosystv.blogspot.com/2018/05/a-female-cop-to-lead-police-federation.html?spref=tw …,2018-05-18 18:11:40+00:00,0,0,,,
997539078299144193,https://twitter.com/JohnBes75014477/status/997539078299144193,JohnBes75014477,,"A new blockchain trade finance and supply chain test is underway involving big banks in India, led by IT multinational InfoSys.",2018-05-18 18:07:04+00:00,0,2,,,
997539042785931264,https://twitter.com/reis_infosys/status/997539042785931264,reis_infosys,,"#Friday, here we come! @reis_infosys wishes everyone safe and fun #VictoriaDay long weekend! pic.twitter.com/7GxM6q1Swg",2018-05-18 18:06:55+00:00,0,1,@reis_infosys,#Friday #VictoriaDay,
997537440045903872,https://twitter.com/cryptoartchitec/status/997537440045903872,cryptoartchitec,,Leading Indian Banks Form Blockchain Trade Network with InfoSys https://ift.tt/2wTuUUr,2018-05-18 18:00:33+00:00,0,0,,,
997535896344940554,https://twitter.com/BTCinformation/status/997535896344940554,BTCinformation,,Seven of #India’s largest banks have joined a #Blockchain-powered trade finance initiative led by Indian IT giant @Infosys via https://cointelegraph.com/news/india-seven-major-banks-begin-testing-blockchain-trade-finance-platform … #CryptoNews #Crypto,2018-05-18 17:54:25+00:00,0,1,@Infosys,#India #Blockchain #CryptoNews #Crypto,
997534064189100033,https://twitter.com/BitcoinInsidr/status/997534064189100033,BitcoinInsidr,,Infosys Partners with 7 Banks for Blockchain Trade Finance Network http://dlvr.it/QTKBVZ,2018-05-18 17:47:08+00:00,0,0,,,
997533536272830464,https://twitter.com/Boston_HR/status/997533536272830464,Boston_HR,,"Senior Project Manager – US: Role Senior Project Manager – US Auto req ID 26313BR Domain Insurance Country USA State / Region / Province Massachusetts Work Location Boston, MA Company Infosys McCamish Job Description Infosys McCamish – Senior Project… http://tw.eet.link/QTK9zd pic.twitter.com/uhvtbgp7Uo",2018-05-18 17:45:02+00:00,0,0,,,
997530455472791552,https://twitter.com/santimes_stock/status/997530455472791552,santimes_stock,,"As Omnicom Group $OMC Stock Value Declined, Shareholder Arcadia Investment Management Cut Stake; Infosys Tech Adr $INFY Shares Rose While Linden Advisors LP Has Decreased Its Holding https://santimes.com/as-omnicom-group-omc-stock-value-declined-shareholder-arcadia-investment-management-cut-stake-infosys-tech-adr-infy-shares-rose-while-linden-advisors-lp-has-decreased-its-holding/ …",2018-05-18 17:32:48+00:00,0,0,,,
997530013653258240,https://twitter.com/dailypoliticaln/status/997530013653258240,dailypoliticaln,,Infosys $INFY Downgraded by ValuEngine to Hold http://www.dailypolitical.com/?p=2046797,2018-05-18 17:31:03+00:00,0,0,,,
997529703639470080,https://twitter.com/Rajan10000586/status/997529703639470080,Rajan10000586,,Fake quote of Infosys co-founder Narayana Murthy praising PM Modi viral on social media https://www.altnews.in/fake-quote-of-infosys-co-founder-narayana-murthy-praising-pm-modi-viral-on-social-media/ … via @AltNews,2018-05-18 17:29:49+00:00,0,0,@AltNews,,
997529508382216199,https://twitter.com/ZolmaxNews/status/997529508382216199,ZolmaxNews,,Infosys $INFY Cut to Hold at ValuEngine http://zolmax.com/?p=2227213,2018-05-18 17:29:02+00:00,0,0,,,
997529434235244545,https://twitter.com/NitinRaut2/status/997529434235244545,NitinRaut2,,Retweeted Pratik Sinha ( @free_thinker): Fake quote of Infosys co-founder Narayana Murthy praising PM Modi viral on social media https://www.altnews.in/fake-quote-of-infosys-co-founder-narayana-murthy-praising-pm-modi-viral-on-social-media/ … https://www.altnews.in/fake-quote-of-infosys-co-founder-narayana-murthy-praising-pm-modi-viral-on-social-media/ …,2018-05-18 17:28:44+00:00,1,1,@free_thinker,,
997528718775148545,https://twitter.com/stocknewstimes/status/997528718775148545,stocknewstimes,,Infosys $INFY Downgraded by ValuEngine to Hold http://stocknewstimes.com/?p=2468114 #stocks,2018-05-18 17:25:54+00:00,0,0,,#stocks,
997525083705954304,https://twitter.com/Hacking_Crypto/status/997525083705954304,Hacking_Crypto,,Infosys Partners with 7 Banks for Blockchain Trade Finance Network #Cryptocurrency $LTC $ETH http://www.hackingcrypto.com/posts/Y9XJA/infosys-partners-with-7-banks-for-blockchain-trade-finance-network …,2018-05-18 17:11:27+00:00,0,0,,#Cryptocurrency,
997523329333497856,https://twitter.com/Ramya_FC/status/997523329333497856,Ramya_FC,,Fake quote of Infosys co-founder Narayana Murthy praising PM Modi viral on social media! @divyaspandana #FakeInIndia #BJP420 https://www.altnews.in/fake-quote-of-infosys-co-founder-narayana-murthy-praising-pm-modi-viral-on-social-media/ … via @AltNews,2018-05-18 17:04:29+00:00,26,43,@divyaspandana @AltNews,#FakeInIndia #BJP420,
997522348122222592,https://twitter.com/Syntricoltd/status/997522348122222592,Syntricoltd,,Leading Indian Banks Form #Blockchain Trade Network with InfoSys http://www.the-blockchain.com/2018/05/18/leading-indian-banks-form-blockchain-trade-network-with-infosys/ …pic.twitter.com/fbyadRgTyU,2018-05-18 17:00:35+00:00,0,0,,#Blockchain,
997521718624378880,https://twitter.com/Bitcoins__News/status/997521718624378880,Bitcoins__News,,"Infosys, Banks Build #Blockchain Finance Network: - Infosys, Banks Build Blockchain Finance… https://goo.gl/fb/pE77hq @Bitcoins__News",2018-05-18 16:58:05+00:00,0,0,@Bitcoins__News,#Blockchain,
997520901750099970,https://twitter.com/GoyunInfo/status/997520901750099970,GoyunInfo,,"Check out my new blog: Infosys, Banks Build Blockchain Finance Network https://ift.tt/2wR1E0L",2018-05-18 16:54:50+00:00,0,0,,,
997520457141190657,https://twitter.com/anycoin_news/status/997520457141190657,anycoin_news,,Infosys с банками-партнерами развивает блокчейн-проект по финансированию торговли https://goo.gl/BR4eeY pic.twitter.com/t0BV2NL3yl,2018-05-18 16:53:04+00:00,0,0,,,
997516210626588672,https://twitter.com/AjitGJoshi/status/997516210626588672,AjitGJoshi,,Ravi Venkatesan steps down from Infosys board https://tech.economictimes.indiatimes.com/news/people/ravi-venkatesan-steps-down-from-infosys-board/64126177?utm_source=RSS&utm_medium=ETRSS …,2018-05-18 16:36:12+00:00,0,0,,,
997515230321299457,https://twitter.com/Global_Infosys/status/997515230321299457,Global_Infosys,,"At work the majority of us experience #stress daily, Reduce your stress this weekend - Get moving & Make time to relax! #healthawarenessweeek #fridaythoughts #friday #weekend #MentalHealthWeek #MentalHealthAwarenessWeekpic.twitter.com/RnV1K2JOWj",2018-05-18 16:32:18+00:00,0,0,,#stress #healthawarenessweeek #fridaythoughts #friday #weekend #MentalHealthWeek #MentalHealthAwarenessWeekpic,
997514745551896582,https://twitter.com/osambha/status/997514745551896582,osambha,,Fake quote of Infosys co-founder Narayana Murthy praising PM Modi viral on social media https://www.altnews.in/fake-quote-of-infosys-co-founder-narayana-murthy-praising-pm-modi-viral-on-social-media/ … via @AltNews,2018-05-18 16:30:22+00:00,0,1,@AltNews,,
997513714235457537,https://twitter.com/ed_paris/status/997513714235457537,ed_paris,,"VC/BC: http://goo.gl/QfYG9s Infosys, Banks Build Blockchain Finance Network http://dlvr.it/QTJmrh pic.twitter.com/7etHyohuKe",2018-05-18 16:26:17+00:00,0,0,,,
997513254946537472,https://twitter.com/dewashish_dev/status/997513254946537472,dewashish_dev,,"@NammaBESCOM are you waiting for someone to die here? This high voltage open wiring is on the middle of the footpath and hight is not even 3 feets. Even a child can touch this. Please take action before it is too late. Location: ECity Phase1, opp. to Infosys Outer Parking Gate pic.twitter.com/WEmTY2USbm",2018-05-18 16:24:27+00:00,0,0,@NammaBESCOM,,
997511865105199105,https://twitter.com/urlninja/status/997511865105199105,urlninja,,Fake quote of Infosys co-founder Narayana Murthy praising PM Modi viral on social media https://www.altnews.in/fake-quote-of-infosys-co-founder-narayana-murthy-praising-pm-modi-viral-on-social-media/ …,2018-05-18 16:18:56+00:00,0,0,,,
997511751762698245,https://twitter.com/santimes_stock/status/997511751762698245,santimes_stock,,Boston Common Asset Management Lowered Infosys LTD Sponsored Adr $INFY Position By $2.19 Million; Steadfast Capital Management LP Lowered Its Visa $V Holding https://santimes.com/boston-common-asset-management-lowered-infosys-ltd-sponsored-adr-infy-position-by-2-19-million-steadfast-capital-management-lp-lowered-its-visa-v-holding/ …,2018-05-18 16:18:29+00:00,0,0,,,
997510867863433216,https://twitter.com/bprasad2005/status/997510867863433216,bprasad2005,,Fake quote of Infosys co-founder Narayana Murthy praising PM Modi viral on social media https://www.altnews.in/fake-quote-of-infosys-co-founder-narayana-murthy-praising-pm-modi-viral-on-social-media/ …,2018-05-18 16:14:58+00:00,0,0,,,
997508704323842048,https://twitter.com/muralikumarje/status/997508704323842048,muralikumarje,,INFOSYS ADR pic.twitter.com/KZIdDYFqHY,2018-05-18 16:06:22+00:00,0,0,,,
997508082950287361,https://twitter.com/GlobalChamIND/status/997508082950287361,GlobalChamIND,,India-based Tech Company #Infosys Will Build Training Center at Old Indianapolis Airport... adding 3000 jobs #education #India @Infosys #Indianapolis #Indianahttps://www.nuvo.net/news/infosys-bring-3000-jobs-to-indy-with-training-center-at-old-indianapolis-airport/article_a7d068d8-4995-11e8-a464-eb11ba205888.html …,2018-05-18 16:03:54+00:00,0,2,@Infosys,#Infosys #education #India #Indianapolis #Indianahttps,
997507408674131968,https://twitter.com/BChainItalia/status/997507408674131968,BChainItalia,,"https://ift.tt/2wR4jr7 - Infosys, Banks Build Blockchain Finance Network pic.twitter.com/QnGe2EEEp3",2018-05-18 16:01:13+00:00,0,0,,,
997507359378460672,https://twitter.com/cryptoartchitec/status/997507359378460672,cryptoartchitec,,"Infosys, Banks Build Blockchain Finance Network https://ift.tt/2rSknDe",2018-05-18 16:01:01+00:00,0,0,,,
997507321822621698,https://twitter.com/e85lab/status/997507321822621698,e85lab,,"How can we help people who are “data rich” but not economically so? Come listen to the co-founder of @Infosys, @NandanNilekani to find out! Excited to be partnering with @PeaceTechLab and @USIP. RSVP! --> http://bit.ly/2KvvUAc pic.twitter.com/lqqe0RJLgk",2018-05-18 16:00:52+00:00,1,2,@Infosys @NandanNilekani @PeaceTechLab @USIP,,
997507265350389761,https://twitter.com/GlobalChamber/status/997507265350389761,GlobalChamber,,India-based Tech Company #Infosys Will Build Training Center at Old Indianapolis Airport... adding 3000 jobs https://www.nuvo.net/news/infosys-bring-3000-jobs-to-indy-with-training-center-at-old-indianapolis-airport/article_a7d068d8-4995-11e8-a464-eb11ba205888.html … @GlobalChamIND #education #India @Infosys,2018-05-18 16:00:39+00:00,4,24,@GlobalChamIND @Infosys,#Infosys #education #India,
997506900466974721,https://twitter.com/advisor_local/status/997506900466974721,advisor_local,,"Infosys, Banks Build Blockchain Finance Network https://cryptopanic.com/news/1965648/Infosys-Banks-Build-Blockchain-Finance-Network …",2018-05-18 15:59:12+00:00,0,0,,,
997506556555091968,https://twitter.com/heraldks/status/997506556555091968,heraldks,,Kbc Group Nv Has Lowered By $7.66 Million Its United Contl Hldgs $UAL Stake; Last Week Infosys Limited $INFY Coverage https://heraldks.com/kbc-group-nv-has-lowered-by-7-66-million-its-united-contl-hldgs-ual-stake-last-week-infosys-limited-infy-coverage/ …,2018-05-18 15:57:50+00:00,0,0,,,
997506188567859201,https://twitter.com/arunshivram/status/997506188567859201,arunshivram,,Asian ERG experiance fair @NM_MKE @Infosys pic.twitter.com/f7rnmB6Vj1,2018-05-18 15:56:22+00:00,0,1,@NM_MKE @Infosys,,
997505451989393409,https://twitter.com/andie_c_henrich/status/997505451989393409,andie_c_henrich,,"How can organizations with traditional #ERP systems embrace smarter technologies and empower decision-making? Explore the possibilities of #IoT, #machinelearning & #automation with Infosys at booth 530 at #SAPPHIRENOW! #ASUG2018 #InfyatSapphirehttp://my.sociabble.com/FBVHrXQb",2018-05-18 15:53:27+00:00,0,1,,#ERP #IoT #machinelearning #automation #SAPPHIRENOW #ASUG2018 #InfyatSapphirehttp,
997505287564259328,https://twitter.com/InfosysConsltng/status/997505287564259328,InfosysConsltng,,. @Infosys’ Ramakrishnan Krishnan explains in @ITProPortal how #DataAnalytics can inform new #retail initiativeshttps://bit.ly/2rIaDvY,2018-05-18 15:52:47+00:00,1,1,@Infosys @ITProPortal,#DataAnalytics #retail,
997505106772987905,https://twitter.com/WorkFusion/status/997505106772987905,WorkFusion,,"Exploring “best practices to drive automation initiatives,” Monica Jonas @moniczko2000 of WorkFusion shared top customer Qs with Melissa Edwards of @KPMG_US & Jessica Radow of @Infosys. Here Melissa discusses ongoing necessity of people in building AI ecosystems. #Ascend18NYCpic.twitter.com/IFDleuVzkZ",2018-05-18 15:52:04+00:00,1,1,@moniczko2000 @KPMG_US @Infosys,#Ascend18NYCpic,
997504962828652545,https://twitter.com/gtbdirectory/status/997504962828652545,gtbdirectory,,Infosys Finacle forms blockchain-based trade network in India http://gtbdirectory.com/?p=80929,2018-05-18 15:51:30+00:00,0,0,,,
997504813834428416,https://twitter.com/waglenikhil/status/997504813834428416,waglenikhil,,Fake quote of Infosys co-founder Narayana Murthy praising PM Modi viral on social media https://www.altnews.in/fake-quote-of-infosys-co-founder-narayana-murthy-praising-pm-modi-viral-on-social-media/ … via @AltNews,2018-05-18 15:50:55+00:00,58,103,@AltNews,,
997504425521491973,https://twitter.com/Cpt_Naveen/status/997504425521491973,Cpt_Naveen,,"Ho, 9km? We are well on our way to beat the record holders in china that had 180km!",2018-05-18 15:49:22+00:00,0,1,,,
997503695297351680,https://twitter.com/shashibk/status/997503695297351680,shashibk,,No many of us stuck in 9 km jam on ORR,2018-05-18 15:46:28+00:00,0,2,,,
